{
  "v": 1,
  "caseId": "case-01-text-stream",
  "version": 1,
  "title": "Completed text streaming",
  "taskInput": "Say hello.",
  "executionBinding": { "provider": "fake", "model": "fake-model", "transport": "native" },
  "harnessConfigDigest": "sha256:3d60ea4774581d65eb9bd8de7f29e2e28a92bb4741828cd09347a007689f17ec",
  "budget": {},
  "verifier": "deterministic-lane",
  "outcomeCriteria": { "expect": "completed", "expectContextBlock": false },
  "script": [
    {
      "kind": "chunks",
      "chunks": [
        { "type": "TextDelta", "text": "Hello" },
        {
          "type": "Done",
          "input_tokens": 2,
          "output_tokens": 1,
          "cache_read_input_tokens": 0,
          "cache_creation_input_tokens": 0
        }
      ]
    }
  ]
}
